{"crate":"storage","generated_at":"2026-09-17","items":[{"category":"重复","current":"test 模块内约 10 个用例各自重复 Config::builder + credentials_provider + region + endpoint_url + force_path_style + http_client + from_client 共约 15 行，仅 bucket/前缀/URL 参数不同。新增用例会继续复制该样板。","file":"src/s3.rs","id":"storage-001","lines":"541-855","proposal":"抽取一个返回 (S3Storage, RequestReceiver) 的测试 helper（如 test_storage(bucket, prefix, base_url)），各用例只传差异参数；不断言行为，只收敛脚手架。","severity":"中","status":"pending","title":"测试客户端构造样板重复","updated_at":"2026-09-17"},{"category":"重复","current":"S3Storage::new 先调 validate_config（内部解析 public_base_url 与 normalize_prefix 做纯校验），随后构造时又再次解析 public_base_url 与 normalize_prefix。同一输入被解析两次，校验与构造可能漂移。","file":"src/s3.rs","id":"storage-002","lines":"165-189","proposal":"让校验函数返回规范化后的 (Url, Option<String>) 或拆分为返回值的 parse/normalize 函数，new 直接复用其结果，消除双重解析；错误语义保持不变。","severity":"低","status":"pending","title":"配置校验与构造重复解析","updated_at":"2026-09-17"},{"category":"性能隐患","current":"save_with_content_type 用 ByteStream::from(content.to_vec()) 把调用方切片全量复制一份后再发送，大文件时内存占用翻倍；与 README 中大文件走分片直传的引导之间缺少显式衔接。","file":"src/s3.rs","id":"storage-003","lines":"201-215","proposal":"保持签名不变的前提下，内部改用零拷贝体（如 Bytes 共享）或在文档注释中明确大文件改走分片上传路径；不改变保存语义。","severity":"中","status":"pending","title":"保存全量复制请求体","updated_at":"2026-09-17"},{"category":"性能隐患","current":"read 把响应体 collect 全量加载为 Vec<u8> 后返回，没有流式出口；大对象读取必然占满内存，且调用方无法边下边处理。","file":"src/s3.rs","id":"storage-004","lines":"251-257","proposal":"在不删除现有 read 的前提下，新增返回 ByteStream/流的读取方法供大对象使用，read 本体保留为便利封装；错误映射保持一致。","severity":"中","status":"pending","title":"读取缺少流式出口","updated_at":"2026-09-17"},{"category":"错误处理","current":"complete_multipart_upload 只校验 parts 非空：空 etag、空 upload_id 不拦截，分片序号范围（1-10000，与 presign 不一致）不校验，分片顺序/重复也不处理，直接发往 S3 才报错，失败定位靠后。","file":"src/s3.rs","id":"storage-005","lines":"341-372","proposal":"发送前做与 presign 同口径的本地校验（非空 upload_id/etag、序号范围），并明确是否按序号排序/去重后发送；在文档注释中写明前置条件。","severity":"中","status":"pending","title":"合并分片缺少本地校验","updated_at":"2026-09-17"},{"category":"性能隐患","current":"delete 为返回 NotFound 先发 HeadObject 确认存在，再发 DeleteObject，共两次往返；高频删除场景下延迟与成本翻倍，且两次调用之间存在 TOCTOU 间隙。","file":"src/s3.rs","id":"storage-006","lines":"401-425","proposal":"去掉预检 Head，直接发 DeleteObject 并把服务端“不存在”错误映射为 Error::NotFound，对外行为（存在删除、缺失报 NotFound）保持一致。","severity":"中","status":"pending","title":"删除双请求预检","updated_at":"2026-09-17"},{"category":"可读性","current":"endpoint 校验用手写 strip_prefix + 空白扫描（is_valid_endpoint），而 public_base_url 用 Url::parse 严格解析；两者严格程度不一致，endpoint 含非法字符/端口等情况靠 SDK 滞后报错。","file":"src/s3.rs","id":"storage-007","lines":"486-496","proposal":"endpoint 校验同样复用 Url 解析口径（要求 http/https + 主机），与 public_base_url 保持一致；拒绝语义仍为 InvalidConfig。","severity":"低","status":"pending","title":"endpoint 校验口径不一致","updated_at":"2026-09-17"},{"category":"复杂度","current":"path.rs 先 validate_relative_path 全量遍历一次，再由 object_key_path 第二次遍历转换，第二次用 unreachable!() 依赖第一次的不变式；两遍逻辑需同步维护。","file":"src/path.rs","id":"storage-008","lines":"7-52","proposal":"合并为单次遍历直接生成 segments，非法分量即时返回 PathError，消除 unreachable!()；对外错误语义不变。","severity":"低","status":"pending","title":"路径校验与转换两遍遍历","updated_at":"2026-09-17"},{"category":"可读性","current":"presign 用 ByteStream::from_static(b\"\") 空体占位参与签名，分片序号上下限写死为 1..=10_000 魔法数；读者需自行推断空体与取值来源。","file":"src/s3.rs","id":"storage-009","lines":"306-331","proposal":"抽取具名常量（如 MAX_PART_NUMBER）并给空体占位加一句注释说明其仅用于签名、不产生网络体；不改变签名结果。","severity":"低","status":"pending","title":"预签名魔法数与空体占位","updated_at":"2026-09-17"},{"category":"测试性","current":"completes_multipart_upload 测试用 .await.ok() 吞掉合并结果，只断言请求体字符，合并失败不会使测试变红；且 delete 的 Head+Delete 行为、read/get 的 NotFound 映射均无用例覆盖，与 README 描述的行为无测试锚点。","file":"src/s3.rs","id":"storage-010","lines":"711-749","proposal":"将吞结果改为断言 Ok，并补 delete 存在/缺失两条与 read 缺失映射 NotFound 的用例，全部基于现有 capture_request 模拟客户端，不连真实 S3。","severity":"中","status":"pending","title":"分片完成测试吞结果且删除路径无覆盖","updated_at":"2026-09-17"}],"source":"backend/crates/storage/src","stats":{"approx_loc":935,"file_count":4,"largest_files":["src/s3.rs"]},"top3":["storage-006","storage-005","storage-001"]}