{
  "crate": "test-support",
  "generated_at": "2026-09-17",
  "items": [
    {
      "category": "可读性",
      "current": "seed.rs 模块注释与常量注释引用 database/src/indexes/access_control.rs、database/src/casbin_adapter.rs、services/iam/rbac.rs，三处路径在仓库中均已不存在（旧三层已删除），读者按注释无法定位契约来源。",
      "file": "src/seed.rs",
      "id": "test-support-001",
      "lines": "1-28",
      "proposal": "把注释指向现行拥有领域与 RBAC 实现位置，或退化为只描述行为契约（集合名、规则文档形态），不再引用已删除路径。",
      "severity": "中",
      "status": "done",
      "title": "种子注释引用已删除的旧三层路径",
      "updated_at": "2026-09-17",
      "note": "注释改指现行拥有领域与 RBAC 实现位置，不再引用已删除的旧三层路径。"
    },
    {
      "category": "可读性",
      "current": "insert_role_and_policies 文档称“写入一条 p 权限规则 + 一条 g 角色绑定规则”，实际按 SEED_PERMISSIONS 写入 3 条 p 规则 + 1 条 g 规则（smoke 测试断言总数为 4），注释与行为不符。",
      "file": "src/seed.rs",
      "id": "test-support-002",
      "lines": "78-82",
      "proposal": "修正注释为实际条数构成（N 条 p 权限规则 + 1 条 g 绑定规则，与 SEED_PERMISSIONS 联动描述）。",
      "severity": "低",
      "status": "done",
      "title": "角色种子注释与实际写入条数不符",
      "updated_at": "2026-09-17",
      "note": "修正为 N 条 p 权限规则 + 1 条 g 绑定规则，与 SEED_PERMISSIONS 联动描述。"
    },
    {
      "category": "错误处理",
      "current": "TestApi::send 全链路用 expect：Bearer token 构造、请求构造、oneshot 路由调用、响应体读取失败全部 panic；与本 crate 其余辅助（new/seed/mint_jwt/assert_indexes）返回 Result 的风格不一致，调用方无法区分失败原因。",
      "file": "src/api.rs",
      "id": "test-support-003",
      "lines": "66-92",
      "proposal": "send 返回 Result<(u16, Value), Error> 并新增对应错误变体，或在类型文档中显式声明 panic 契约，二选一保持一致。",
      "severity": "中",
      "status": "done",
      "title": "TestApi 全链路 expect 直接 panic",
      "updated_at": "2026-09-17",
      "note": "采用显式声明 panic 契约方案：类型文档 # Panics 声明失败直接 panic，测试夹具无需恢复错误。"
    },
    {
      "category": "重复",
      "current": "公开 API 仅有 get/post 两个薄包装，新增 PUT/PATCH/DELETE 时只能继续复制 send 转调样板；send 本身已是通用实现却保持私有。",
      "file": "src/api.rs",
      "id": "test-support-004",
      "lines": "32-55",
      "proposal": "公开通用的 request(method, path, token, json) 方法，get/post 转调它，后续方法不再复制样板。",
      "severity": "低",
      "status": "done",
      "title": "缺少通用 request 入口会导致方法包装复制",
      "updated_at": "2026-09-17",
      "note": "新增公开 request(method,path,token,json) 通用入口，get/post 转调它。"
    },
    {
      "category": "性能隐患",
      "current": "响应体用 to_bytes(usize::MAX) 读取，实际解除了包大小上限；测试客户端虽风险低，但属于无界内存读取。",
      "file": "src/api.rs",
      "id": "test-support-005",
      "lines": "89-90",
      "proposal": "引入有界常量（如 8 MiB）作为读取上限，超限走与第 003 条统一后的错误路径。",
      "severity": "低",
      "status": "done",
      "title": "响应体读取使用 usize::MAX 无界上限",
      "updated_at": "2026-09-17",
      "note": "新增 MAX_RESPONSE_BYTES（8 MiB）有界读取上限。"
    },
    {
      "category": "可读性",
      "current": "同一函数内 AUTHORIZATION 使用 axum 常量，而 content-type 用小写字符串字面量 \"content-type\"，头引用风格混用。",
      "file": "src/api.rs",
      "id": "test-support-006",
      "lines": "74-82",
      "proposal": "统一使用 axum::http::header::CONTENT_TYPE 常量。",
      "severity": "低",
      "status": "done",
      "title": "请求头常量与字符串字面量混用",
      "updated_at": "2026-09-17",
      "note": "统一使用 axum::http::header::CONTENT_TYPE 常量。"
    },
    {
      "category": "错误处理",
      "current": "Drop 每次派生独立线程建运行时清理数据库，运行时构建失败与 database.drop 错误均被静默丢弃；fire-and-forget 清理可能在进程退出前未完成，造成测试库残留污染。",
      "file": "src/db.rs",
      "id": "test-support-007",
      "lines": "97-110",
      "proposal": "提供显式 async close/cleanup 方法供测试在用例末尾调用并传播错误，Drop 仅保留尽力而为兜底并注释说明。",
      "severity": "中",
      "status": "done",
      "title": "Drop 清理静默丢弃错误且不保证完成",
      "updated_at": "2026-09-17",
      "note": "新增显式 async cleanup() 供用例末尾调用并传播错误，Drop 仅保留尽力而为兜底并文档说明。"
    },
    {
      "category": "错误处理",
      "current": "drop_named_indexes 是唯一返回 mongodb::error::Result 而非 crate::Result 的公开方法，与 TestDb::new、seed、mint_jwt 的错误风格不一致（Error 已有 #[from] 可直接转换）。",
      "file": "src/db.rs",
      "id": "test-support-008",
      "lines": "84-94",
      "proposal": "签名改为返回 crate::Result<()>，内部用 ? 依赖已有的 From 转换。",
      "severity": "低",
      "status": "done",
      "title": "drop_named_indexes 未使用统一错误类型",
      "updated_at": "2026-09-17",
      "note": "签名改为 crate::Result<()>，内部用 ? 依赖已有 From 转换。"
    },
    {
      "category": "可读性",
      "current": "uuid_hex 无参返回 32 位 hex，调用方用魔数切片 [..8]（角色 ID）与 [..12]（账号 ID）截取；长度契约只存在于调用点，一旦改动实现即越界 panic。",
      "file": "src/db.rs",
      "id": "test-support-009",
      "lines": "145-150",
      "proposal": "改为带长度参数的辅助（如 uuid_hex_n）或为两种用途定义具名常量，把长度契约收拢到一处。",
      "severity": "低",
      "status": "done",
      "title": "调用点魔数切片截取随机串",
      "updated_at": "2026-09-17",
      "note": "新增 uuid_hex_n(len) 带长度参数辅助及 DB/ROLE/ACCOUNT 具名后缀长度常量，超长按 32 饱和不越界。"
    },
    {
      "category": "可读性",
      "current": "MAX_DB_NAME_LEN 注释称“最大字节数”，但实现用 chars().take 按字符计数；因字符集已过滤为 ASCII 实际等价，但注释误导后来人按字节理解。",
      "file": "src/db.rs",
      "id": "test-support-010",
      "lines": "8-9",
      "proposal": "修正注释为字符数口径，或改为按字节截断并处理字符边界。",
      "severity": "低",
      "status": "done",
      "title": "库名前缀截断注释字节与实现字符口径不一",
      "updated_at": "2026-09-17",
      "note": "注释修正为字符数口径并说明 ASCII 字符集下与字节等价。"
    },
    {
      "category": "错误处理",
      "current": "matches 对 $and/$or 数组元素直接 unwrap as_document，对未知组合操作则用 assert_eq 长度 + expect $in 两步断言；三处失败点信息不一致，新增操作符时容易漏改。",
      "file": "src/filter.rs",
      "id": "test-support-011",
      "lines": "19-31",
      "proposal": "收敛为统一的“未知查询操作”失败辅助函数，所有不支持分支走同一 panic 信息。",
      "severity": "中",
      "status": "done",
      "title": "未知查询操作失败点分散且信息不一致",
      "updated_at": "2026-09-17",
      "note": "收敛为 unsupported_operator/unsupported_as_document 统一失败辅助。"
    },
    {
      "category": "重复",
      "current": "require_mongo! 三个分支复制同一段 SKIP eprintln 文案（含 mongo:7 副本集提示），改提示语需同步三处。",
      "file": "src/lib.rs",
      "id": "test-support-012",
      "lines": "55-83",
      "proposal": "抽取私有的 skip_mongo_test() 发散函数或共享提示常量，三个分支共用。",
      "severity": "低",
      "status": "done",
      "title": "require_mongo! 跳过提示文案三处复制",
      "updated_at": "2026-09-17",
      "note": "抽取 MONGO_SKIP_HINT 共享提示常量，三个分支共用。"
    },
    {
      "category": "错误处理",
      "current": "exp 计算用 u64::try_from(timestamp).unwrap_or_default()，1970 年前时间被静默归零再加有效期，边界语义不透明。",
      "file": "src/jwt.rs",
      "id": "test-support-013",
      "lines": "40-40",
      "proposal": "显式处理负时间戳分支（如 saturating 取零并注释），使边界行为可读。",
      "severity": "低",
      "status": "done",
      "title": "JWT 过期时间负时间戳被静默归零",
      "updated_at": "2026-09-17",
      "note": "负时间戳显式饱和取零并注释边界语义。"
    },
    {
      "category": "重复",
      "current": "private_claims 内 \"backoffice\"/\"admin\"/声明键名字符串硬编码，与 web-api 的同步只靠注释维系；seed_login 与 ACCOUNT_VERSION 已有跨函数复用，声明常量反而缺失。",
      "file": "src/jwt.rs",
      "id": "test-support-014",
      "lines": "57-65",
      "proposal": "抽取具名常量承载声明键值并注明与 web-api TokenPayload 的同步契约。",
      "severity": "低",
      "status": "done",
      "title": "JWT 私有声明键值硬编码散落",
      "updated_at": "2026-09-17",
      "note": "抽取 CLAIM_* 具名常量并注明与 web-api TokenPayload 的同步契约。"
    },
    {
      "category": "性能隐患",
      "current": "缺失索引收集用 names 全量 to_string 再逐个线性 any 查找，是 O(n*m) 比较加全量分配；集合虽小但写法可用集合差集优化。",
      "file": "src/indexes.rs",
      "id": "test-support-015",
      "lines": "24-33",
      "proposal": "将 existing 建为 HashSet 后做差集判定，避免逐个线性查找与多余分配。",
      "severity": "低",
      "status": "done",
      "title": "索引缺失判定为 O(n*m) 线性查找",
      "updated_at": "2026-09-17",
      "note": "existing 建 HashSet 后做差集判定，避免逐个线性查找与多余分配。"
    }
  ],
  "source": "backend/AGENTS.md + backend/crates/test-support/README.md + src 8 文件 + tests/smoke.rs，只读分析未改行为",
  "stats": {
    "approx_loc": 715,
    "file_count": 8,
    "largest_files": [
      "src/db.rs",
      "src/seed.rs",
      "src/api.rs"
    ]
  },
  "top3": [
    "test-support-001",
    "test-support-003",
    "test-support-007"
  ]
}
