{"crate":"erp-returns","generated_at":"2026-09-17","items":[{"category":"重复","current":"src/repository/owned/ 下八个文件（customer_refund/payment_reversal/purchase_return_line/purchase_return_order/receipt_reversal/sales_return_case/sales_return_line/supplier_refund）各约267行，抽样 customer_refund.rs 全文件为 new/database/collection/create/find_by_id/update/soft_delete 等委托给 inner persistence_core::Repository 的薄包装，与其他七个文件逐字同构，仅实体类型名不同。","file":"src/repository/owned/customer_refund.rs","id":"erp-returns-001","lines":"1-267","proposal":"不改行为前提下抽取泛型基类或声明宏生成 owned 仓储薄包装，保留各类型公开名与签名；特异查询仍留在原 impl 模块作 inherent 方法。","severity":"高","status":"pending","title":"owned 八仓储薄包装代码逐字重复","updated_at":"2026-09-17"},{"category":"重复","current":"customer_refund/supplier_refund/receipt_reversal/payment_reversal 四个实体文件（各约488-557行）结构近逐字相同：同一四态枚举（Draft/InApproval/Posted/Reversed）及完全一致的 label/as_str/allowed_next，同一套 new/update/transition/start_approval/cancel_approval/mark_posted/is_posted/matches_version/ensure_initial_approval_state 方法骨架，仅字段名（refund_no/reversal_no）与原单引用不同；配套单测（trim/版本/状态机/提交版本/序列化守卫）亦四份重复。","file":"src/entity/returns/customer_refund.rs","id":"erp-returns-002","lines":"22-370","proposal":"抽取共享审批状态机与经办复核/金额正数校验为泛型 helper 或声明宏，四实体只保留各自字段与文案；状态码、校验语义与序列化形态不变。","severity":"高","status":"pending","title":"四资金纠错实体状态机与方法四份重复","updated_at":"2026-09-17"},{"category":"复杂度","current":"src/repository/returns.rs 共1078行，远超生产文件800行上限；三套 Row/Filter/Default/QueryFilter/Pagination、三组 search_*/find_*_by_originals 查询、ReturnsRepository 跨集合写入、排序/投影 helper 与单测同处一文件。","file":"src/repository/returns.rs","id":"erp-returns-003","lines":"1-1078","proposal":"按退货单/退款/冲正拆分仓储查询模块（Filter/Row/search 与特异查询随所属集合走），ReturnsRepository 跨集合写入独立一模块；集合名常量仍以 ReturnsExt 为唯一来源，调用方签名不变。","severity":"高","status":"pending","title":"returns 仓储单文件1078行超限","updated_at":"2026-09-17"},{"category":"重复","current":"src/service/approval.rs 用12个函数承载4类单据的同一套动作：start_*_approval 与 cancel_*_to_draft 均为实体方法的直接透传，4个 ensure_*_final_approve_posting 均为“非 IN_APPROVAL 即 ConflictError”检查，仅入参类型与冲突文案中的单据名不同。","file":"src/service/approval.rs","id":"erp-returns-004","lines":"1-150","proposal":"以状态机 trait（或声明宏）收敛提交/撤回/最终过账守卫，approval.rs 只保留各单据的类型实例化与专属文案；审批语义与冲突文案不变。","severity":"中","status":"pending","title":"审批守卫十二函数仅类型与文案不同","updated_at":"2026-09-17"},{"category":"重复","current":"customer_refund/supplier_refund/receipt_reversal/payment_reversal 四个 service 文件遵循同一流水线：SourceFact 窄结构→prepare/build 草稿与一次提交草稿→load_*（NotFound 文案）→create/persist→prepare_*_post（Reversed 优先于审批态检查）→validate_*_amount（posted 累计+CumulativeAmountLimit 映射）→persist_*_post（mark_posted+CAS 写回）→reject_*_client_post（同一 ConflictError 句式），仅单据名与原单字段不同。","file":"src/service/customer_refund.rs","id":"erp-returns-005","lines":"89-176","proposal":"抽取“读取→Reversed 闸门→审批态守卫→累计限额→过账写回”的泛型流程 helper，各单据只提供累计查询闭包与文案；事务边界与错误分类不变。","severity":"中","status":"pending","title":"四单据服务同形过账流水线重复","updated_at":"2026-09-17"},{"category":"重复","current":"src/dto/requests.rs 中 Submit*（expected_version+idempotency_key）与 Cancel*（再加 reason）请求结构重复四次，Post* 空请求重复四次；四个 Create* 请求共用 reason_code/reason_text/amount/handled_by/reviewed_by/occurred_at 字段组与完全同式的非空校验注解，仅单据编号与原单引用字段不同。","file":"src/dto/requests.rs","id":"erp-returns-006","lines":"141-351","proposal":"引入泛型提交/撤回命令结构（或类型别名基类+扁平化）收敛版本与幂等键字段，Create 共用字段组抽为嵌入结构；DTO 字段名、校验文案与 deny_unknown_fields 语义不变。","severity":"中","status":"pending","title":"提交审批与创建 DTO 四联重复","updated_at":"2026-09-17"},{"category":"重复","current":"src/repository/returns_posted_totals.rs 中 posted_refund_total_by_receipt/posted_refund_total_by_payment/posted_reversal_total_by_receipt/posted_reversal_total_by_payment 四个方法除原单字段名字符串与集合句柄外完全相同，长篇文档注释亦四份复制；底层 posted_total/posted_total_pipeline 已是共享实现。","file":"src/repository/returns_posted_totals.rs","id":"erp-returns-007","lines":"108-222","proposal":"以原单字段名为参数的单一泛型聚合入口收敛四方法（保留各公开名作薄转发如需兼容），文档只写一份；聚合管道与 posted 语义不变。","severity":"中","status":"pending","title":"已过账累计聚合四方法仅字段名不同","updated_at":"2026-09-17"},{"category":"类型建模","current":"build_sales_return_case_and_line 与 build_purchase_return_order_and_line 均只取 req.lines[0] 构造首条明细，其余请求行被静默丢弃；DTO 却要求 lines 至少1条（允许多条），单测甚至断言“只保留首行、次行数量0被忽略”。多行请求的真实意图在类型上无法表达，调用方易误以为全量持久化。","file":"src/service/sales_return.rs","id":"erp-returns-008","lines":"27-56","proposal":"把单行契约显式化为类型（DTO 只收单行，或 service 循环持久化全部行），并在超量时返回明确校验错误而非静默丢弃；保持现有单行成功路径行为不变。","severity":"中","status":"pending","title":"构造器静默丢弃首行之外的明细行","updated_at":"2026-09-17"},{"category":"可读性","current":"prepare_receipt_reversal_post 内连续两次调用 ensure_receipt_reversal_final_approve_posting(&reversal)，中间仅隔一条注释说明“只重复守卫”；第二次调用无任何状态变化可检查，纯属冗余。","file":"src/service/receipt_reversal.rs","id":"erp-returns-009","lines":"101-119","proposal":"删除重复的第二次守卫调用（保留一次），注释说明最终通过守卫的唯一性；过账前置语义不变。","severity":"低","status":"pending","title":"回款冲正预过账重复调用同一守卫","updated_at":"2026-09-17"},{"category":"边界分层","current":"四单据 service 的方法形态不统一：customer_refund/payment_reversal 用 &self+self.db，supplier_refund 混用 &self 与关联函数（db: &Database），receipt_reversal 全用关联函数（db/session）；执行器参数名在 executor 与 session 间混用；load_receipt_reversal 独自用 &mut NoTransaction 直读，其余 load_* 接调用方 executor，事务内可见性语义不一致。","file":"src/service/receipt_reversal.rs","id":"erp-returns-010","lines":"90-170","proposal":"统一为 &self 方法+调用方 executor 形态（或全关联函数二选一），参数名统一为 executor，直读方法注明非事务快照语义；读写路径与事务归属不变。","severity":"低","status":"pending","title":"服务方法接收者与执行器形态不统一","updated_at":"2026-09-17"},{"category":"边界分层","current":"validate_actor_pair 与 validate_original_target 定义在 customer_refund.rs（pub(crate)），被 supplier_refund/payment_reversal/receipt_reversal 以 super::customer_refund:: 路径复用；累计限额已有独立 cumulative_limit.rs 模块，唯独这两处共享校验寄宿在某一具体实体下，形成以客户退款为中心的伪依赖。","file":"src/entity/returns/customer_refund.rs","id":"erp-returns-011","lines":"370-410","proposal":"把两处共享校验移入独立的共享模块（如复用 cumulative_limit.rs 所在层或新建 common），四实体均从该处引用；校验规则与错误文案不变。","severity":"低","status":"pending","title":"共享校验寄宿在客户退款实体下","updated_at":"2026-09-17"},{"category":"类型建模","current":"SalesReturnCase 与 PurchaseReturnOrder 因 StableBase 未派生 PartialEq 而各自手写全字段 eq（8字段逐一比较，注释自述原因）；新增字段时两处必须同步更新，否则相等语义静默过期。","file":"src/entity/returns/sales_return_case.rs","id":"erp-returns-012","lines":"226-244","proposal":"给 StableBase 补 PartialEq/Eq 派生（或提供字段比较 helper），两实体改回派生；相等语义保持全字段一致。","severity":"低","status":"pending","title":"两处理单手写全字段 PartialEq","updated_at":"2026-09-17"},{"category":"可读性","current":"四处一次提交构造器（customer_refund/supplier_refund/receipt_reversal/payment_reversal）均硬编码 reviewed_by: \"finance_reviewer\"，另有 return_command_no 的 \"TK\"/\"GTK\"/\"CZ\"/\"PCZ\" 前缀散落在各调用点；复核人默认值与编号前缀无具名常量，改动需四处同步。","file":"src/service/customer_refund.rs","id":"erp-returns-013","lines":"56-88","proposal":"抽取 DEFAULT_FINANCE_REVIEWER 与各单据编号前缀为具名常量，四构造器复用；默认值与编号形态不变。","severity":"低","status":"pending","title":"默认复核人与编号前缀魔法串四处散落","updated_at":"2026-09-17"},{"category":"错误处理","current":"duplicate_index_conflict_message 忽略 index_name 参数恒返回通用文案（8个 uk_* 唯一索引无法区分指引）；Error::ReceiptDuplicate 变体在整个 workspace 内无任何构造点（From<persistence_core::Error> 把 DuplicateKey 映射为 ConflictError），仅靠 class() 匹配保留，与 web-api 的通用映射形成不对称。","file":"src/error.rs","id":"erp-returns-014","lines":"97-107","proposal":"保持用户文案不泄漏键细节，按索引名区分日志上下文（account/request_id/资源类型只进 tracing），并为 ReceiptDuplicate 补构造点或标记去留；对外错误分类不变。","severity":"低","status":"pending","title":"唯一冲突忽略索引名与未构造变体","updated_at":"2026-09-17"}],"source":"backend/crates/erp-returns","stats":{"approx_loc":9602,"file_count":43,"largest_files":["src/repository/returns.rs (1078)","src/entity/returns/customer_refund.rs (557)","src/entity/returns/supplier_refund.rs (538)","src/entity/returns/payment_reversal.rs (490)","src/entity/returns/receipt_reversal.rs (488)"]},"top3":["erp-returns-001","erp-returns-002","erp-returns-003"]}