{"crate":"id-generator","generated_at":"2026-09-17","items":[{"category":"性能隐患","current":"counter_id 每次取号都走 serialize_to_bson 做完整 serde 序列化，再用 let-else + unreachable 断言必为字符串；该映射实际是 13 个变体的静态常量表，每次调用都重复序列化与分支判断。","file":"src/document_number.rs","id":"id-generator-001","lines":"105-110","note":"done:kind增counter_id_str静态映射，消除每次serde；cargo check -p id-generator/env -u ERP_TEST_MONGO_URI cargo test -p id-generator --lib --locked(7 passed)","proposal":"为 DocumentNumberKind 增加返回 &'static str 的静态映射（如 kind.as_str / counter_id_str），counter_id 直接复用该静态名，消除每次取号的序列化开销与 unreachable 分支。","severity":"中","status":"done","title":"counter_id 每次取号重复走 serde 序列化","updated_at":"2026-09-17"},{"category":"可读性","current":"next_number 仅用 executor.session().is_some() 判断事务状态，把结果以 in_transaction: bool 形参透传给私有 next_seq，而 next_seq 的计数器写入根本不使用该执行器；布尔标记参数让私有签名表意变弱，且日志观测与写入逻辑被拆在两层。","file":"src/document_number.rs","id":"id-generator-002","lines":"196-225","note":"done:去掉next_seq布尔形参，事务日志收敛next_number；同上验证","proposal":"去掉 next_seq 的 in_transaction 布尔形参，把事务状态的 debug 日志收敛到已持有 executor 的 next_number 一层，next_seq 只保留取号职责。","severity":"中","status":"done","title":"next_seq 透传仅用于日志的布尔标记参数","updated_at":"2026-09-17"},{"category":"重复","current":"业务日期格式化字面量散落在两处：format_number 用 \"%Y%m%d\" 组装展示段，next_seq 用 \"%Y-%m-%d\" 写计数器 date 追溯字段；两处格式各自内联，若一处笔误另一处无法约束。","file":"src/document_number.rs","id":"id-generator-003","lines":"148,232","note":"done:抽取display_date/trace_date，格式字面量各一处；同上验证","proposal":"抽取具名的日期段格式化小函数（如展示段 / 追溯段各一），两处调用点复用，格式字面量只出现一次。","severity":"低","status":"done","title":"两处日期格式字面量各自内联","updated_at":"2026-09-17"},{"category":"可读性","current":"KindInfo 结构体只有一个 prefix 字段，info() 的 13 分支 match 仅为构造该单字段包装；调用点还要再经 .prefix 解包，多一层无行为的结构体间接。","file":"src/document_number.rs","id":"id-generator-004","lines":"93-96","note":"done:去掉KindInfo包装，prefix/counter映射直接返回静态串；同上验证","proposal":"去掉 KindInfo 包装，让 kind 到前缀的映射直接返回 &'static str，调用点保持 kind.prefix() 不变。","severity":"低","status":"done","title":"KindInfo 单字段包装无实质作用","updated_at":"2026-09-17"},{"category":"类型建模","current":"Error::CounterMissing 用 kind: String 携带计数器标识，调用方需先分配 counter_id 字符串再传入；而标识本质是 Copy 的 DocumentNumberKind，用字符串传递放宽了类型约束。","file":"src/document_number.rs","id":"id-generator-005","lines":"22-30","note":"done:CounterMissing kind改DocumentNumberKind类型化，Display转静态名；cargo check --workspace通过","proposal":"将 CounterMissing 携带的 kind 改为 DocumentNumberKind（Display 时再转静态名），错误构造点不再依赖预分配的字符串。","severity":"低","status":"done","title":"CounterMissing 用 String 而非类型化 kind","updated_at":"2026-09-17"},{"category":"错误处理","current":"Error 已有 Database(#[from] DatabaseError) 自动转换，又手写了 impl From<mongodb::error::Error>；两条转换路径并存，后续若调整 DatabaseError 与驱动错误的映射关系，需同时维护两处，错误分层归属不唯一。","file":"src/document_number.rs","id":"id-generator-006","lines":"33-38","note":"done:去掉手写From，驱动调用点经DatabaseError::from显式映射；同上验证","proposal":"收敛为单一转换路径：去掉手写 From，在驱动调用点经 DatabaseError::from 显式映射后用 ? 触发自动转换，使驱动错误归属唯一。","severity":"低","status":"done","title":"驱动错误存在两条并存的转换路径","updated_at":"2026-09-17"},{"category":"可读性","current":"next_id 的文档只有两行单段说明，缺少 backend/AGENTS.md 编码约定要求的 # 返回等分段；同 crate 内 format_number、next_number 均已按多行分段书写，公共 API 文档风格不一致。","file":"src/lib.rs","id":"id-generator-007","lines":"13-18","note":"done:补next_id分段文档；纯文档，同上验证","proposal":"按仓库公共方法文档约定补齐 next_id 的分段文档（返回值说明），不改签名与行为。","severity":"低","status":"done","title":"next_id 文档注释缺约定的分段结构","updated_at":"2026-09-17"}],"source":"backend/AGENTS.md、backend/crates/id-generator/README.md、src/lib.rs、src/document_number.rs 只读分析；tests 仅作行为约束参考，未纳入改动","stats":{"approx_loc":364,"file_count":2,"largest_files":["src/document_number.rs"]},"top3":["id-generator-001","id-generator-002","id-generator-003"]}