{"crate":"persistence-core","generated_at":"2026-09-17","items":[{"category":"重复","current":"insert_one/insert_many/update_one/find_one_and_update_pipeline/delete_many/delete_one/find_one/exists/count_documents 各自手写 match executor.session() 的 Some/None 两套驱动调用，仅 find_many 因 SessionCursor 形态略有不同。","file":"src/mongo_ops.rs","id":"persistence-core-001","lines":"30-317","note":"","proposal":"收敛一处会话分发辅助，各函数只保留集合调用本体；find_many 的游标排空循环同步为同一写法，现有执行语义不变。","severity":"中","status":"pending","title":"会话/非会话分支在九个函数内重复","updated_at":"2026-09-17"},{"category":"重复","current":"update/soft_delete/restore 重复“已删除守卫→write_metadata→CAS filter→update_one→apply_write_result”五步，仅守卫方向、filter 构造与 $set 负载不同。","file":"src/repository/base.rs","id":"persistence-core-002","lines":"209-305","note":"","proposal":"抽取组装元数据+过滤器与应用写入结果的私有 helper，三方法只保留守卫方向与 $set 负载差异。","severity":"高","status":"pending","title":"三个 CAS 写入共用同一五步骨架","updated_at":"2026-09-17"},{"category":"重复","current":"find_one_by_field/find_one/find_many/find_many_sorted/list_active_by_ids/exists 各自手写插入 deleted_at 约束，新增查询易遗漏软删除域。","file":"src/repository/base.rs","id":"persistence-core-003","lines":"339-452","note":"","proposal":"抽取 with_active_scope(filter) 私有函数统一附加活跃约束，各查询只传业务条件。","severity":"中","status":"pending","title":"活跃域过滤条件逐函数手写","updated_at":"2026-09-17"},{"category":"性能隐患","current":"search 先用 filter.to_doc() 查页内数据，再经 search_count 对同一 filter 第二次 to_doc() 计数；若 QueryFilter 实现非纯构造，两次文档可能不一致，且多一次构造开销。","file":"src/repository/base.rs","id":"persistence-core-004","lines":"466-503","note":"","proposal":"在 search 内一次绑定 filter_doc，分别借给 find_many 与计数使用，排序与分页参数保持不变。","severity":"低","status":"pending","title":"search 对同一过滤器求值两次","updated_at":"2026-09-17"},{"category":"类型建模","current":"Pagination::limit 用 page_size as i64，search 尾部用 total as i64 把 u64 计数塞进 PageResult.total: i64；极端值下静默截断，且分页模型在 u64/i64 间反复横跳。","file":"src/repository/base.rs","id":"persistence-core-005","lines":"36-66","note":"","proposal":"改用 try_from/saturating 转换并统一 total 的整数类型，现有正常取值区间的行为保持不变。","severity":"低","status":"pending","title":"分页数值用 as 横跨 u64/i64","updated_at":"2026-09-17"},{"category":"类型建模","current":"同模块其余函数均为泛型 Collection<T>，唯独 exists 限定 Collection<Document>，迫使 Repository::exists 另开 self.db.collection::<Document> 句柄。","file":"src/mongo_ops.rs","id":"persistence-core-006","lines":"280-291","note":"","proposal":"将 exists 改为泛型 <T> 实现，投影与短路逻辑不变，调用方复用已有类型化集合。","severity":"低","status":"pending","title":"exists 独占 Collection<Document> 类型","updated_at":"2026-09-17"},{"category":"边界分层","current":"From<mongodb::error::Error> 在识别到唯一键冲突时直接 tracing::warn；类型转换本应纯粹，map_err 链中每次转换都会打日志，重复转换会重复记录，单测构造错误也会触发日志。","file":"src/errors.rs","id":"persistence-core-007","lines":"35-50","note":"","proposal":"移除转换内的日志，将冲突日志上移到写入入口或用例边界统一记录，错误分类映射保持不变。","severity":"中","status":"pending","title":"From 转换内部附带 tracing 副作用","updated_at":"2026-09-17"},{"category":"重复","current":"is_duplicate_key 与 extract_duplicate_index_name 对 Command/Write/InsertMany/BulkWrite 做同样的四分支拆解，后者只为取出 message；新增错误形态需同步两处。","file":"src/errors.rs","id":"persistence-core-008","lines":"68-108","note":"","proposal":"抽取一次匹配返回统一视图供两函数共用，判重码 11000 与标签逻辑保持不变。","severity":"中","status":"pending","title":"错误变体枚举在两处重复匹配","updated_at":"2026-09-17"},{"category":"可读性","current":"parse_index_name_from_message 用 split(\"index: \") 取第二段再按空白截断；大小写、尾随标点、缺 token 时静默返回 None，意图不直观。","file":"src/errors.rs","id":"persistence-core-009","lines":"110-121","note":"","proposal":"抽取具名解析 helper 并补齐边界单测（大小写/标点/缺失），解析成功与失败的返回语义保持不变。","severity":"低","status":"pending","title":"索引名解析依赖裸字符串切分","updated_at":"2026-09-17"},{"category":"复杂度","current":"start_session→start_transaction→回调→commit/abort 全挤在一个约 30 行方法内，成功/失败两路各自做 map_err(E::from)，abort 失败的 warn 与主流程交织。","file":"src/transaction.rs","id":"persistence-core-010","lines":"108-139","note":"","proposal":"拆出会话启动与提交/回滚私有 helper，with_transaction 只保留编排骨架；事务选项与回滚语义不变。","severity":"中","status":"pending","title":"with_transaction 混装会话生命周期与错误映射","updated_at":"2026-09-17"},{"category":"可读性","current":"commit_error_action 首参为裸 bool，调用点只剩 true/false 可读性差；commit_with_retry 内三路 match 与重试循环交织，120s 超时阈值硬编码。","file":"src/transaction.rs","id":"persistence-core-011","lines":"27-69","note":"","proposal":"首参改为具名小枚举，循环体按动作早返；阈值常量与重试语义保持不变，可考虑将超时做成可注入以改善测试性。","severity":"低","status":"pending","title":"提交决策用裸 bool 传递错误标签","updated_at":"2026-09-17"},{"category":"复杂度","current":"topology_supports_transactions 在一个布尔表达式内组合分片/副本集两套 wire version 阈值（7/8）与会话检查；bson_integer 另行处理 Int32/Int64 双形态，分散在同文件内。","file":"src/connection.rs","id":"persistence-core-012","lines":"44-64","note":"","proposal":"拆分为具名谓词分别判定副本集与分片集群，阈值常量就近注释版本来源；判定结果保持不变。","severity":"低","status":"pending","title":"拓扑判定把两套阈值挤进单个表达式","updated_at":"2026-09-17"},{"category":"错误处理","current":"insert_literal_regex_filter 对 None 静默跳过、对已存在同名字段静默覆盖；调用方无法区分“未传值”与“已写入”，覆盖旧条件时无任何信号。","file":"src/repository/regex_filter.rs","id":"persistence-core-013","lines":"4-14","note":"","proposal":"以文档注明覆盖语义并审计调用方，或以加法方式返回 bool 表示是否写入；现有写入行为不变。","severity":"低","status":"pending","title":"正则过滤写入静默跳过与静默覆盖","updated_at":"2026-09-17"}],"source":"backend/crates/persistence-core/src (manual review, no behavior change)","stats":{"approx_loc":1580,"file_count":9,"largest_files":["src/repository/base.rs","src/mongo_ops.rs","src/transaction.rs"]},"top3":["persistence-core-002","persistence-core-001","persistence-core-007"]}