{"crate":"erp-catalog","generated_at":"2026-09-17","items":[{"category":"重复","current":"同一函数体在 product_workflow.rs 尾部（ensure_product_version）和 voucher.rs 尾部（ensure_product_version）各出现一次，都是 has_version 不一致时返回相同的 409 ConflictError 文案。","file":"src/service/catalog/product_workflow.rs","id":"erp-catalog-001","lines":"727-744","proposal":"只保留 support.rs 的 ensure_version（或为 Product 加 ensure_expected_version 方法），两处调用点统一复用，删除两份私有重复函数。","severity":"高","status":"pending","title":"乐观锁版本校验函数两处重复","updated_at":"2026-09-17"},{"category":"重复","current":"ProductRow/SkuRow/SkuRevisionRow/ProductRevisionRow 到 ProductView/SkuView/SkuRevisionView/ProductRevisionView 的逐字段搬运在 product_query.rs（product_page_view、sku_list、sku_revision_list、product_revision_list）和 voucher.rs（voucher_category_profile_list）中各写一遍手写闭包，字段增减时需同步多处。","file":"src/service/catalog/product_query.rs","id":"erp-catalog-002","lines":"180-237","proposal":"按“由实体确定性生成 DTO 走 from_*”的归属约定，给各 Row 类型实现 From<Row> for View（媒体装配等非确定性部分除外），Service 只做 map 调用。","severity":"高","status":"pending","title":"Row 到 View 的逐字段映射多处手写重复","updated_at":"2026-09-17"},{"category":"复杂度","current":"build_spec_edit_plan 横跨签名计算、签名去重登记、Keep/Reactivate/Create 三分支、条码占用校验、SKU 修订构造、移除签名停用扫描、新商品修订构造，一个函数内完成全部规格编辑分类，有效行超过 50 行上限。","file":"src/service/catalog/product_workflow.rs","id":"erp-catalog-003","lines":"477-578","proposal":"按签名分类结果拆私有 helper：classify 一行 SKU（返回 Keep/Reactivate/Create 意图）、sweep 移除签名停用集、assemble 新商品修订，主函数只保留编排。","severity":"高","status":"pending","title":"规格编辑计划构造超长且多职责","updated_at":"2026-09-17"},{"category":"重复","current":"search_product_revisions、search_skus、search_sku_revisions、search_product_brands、search_unit_of_measures 都是“组装 FindOptions（排序/分页/投影）→find_many→count_documents→组装 PageResult”同一骨架，仅排序白名单函数与投影文档不同。","file":"src/repository/catalog/product.rs","id":"erp-catalog-004","lines":"361-395","proposal":"在 repository/catalog/shared.rs 增加通用的分页投影查询 helper（接收 filter 文档、options、行集合），各 search_* 只保留排序与投影特化。","severity":"中","status":"pending","title":"分页投影查询骨架在各仓储重复","updated_at":"2026-09-17"},{"category":"重复","current":"ProductRepository/SkuRepository/SkuRevisionRepository/ProductRevisionRepository 的 find_by_ids（以及 find_by_product_ids、find_by_sku_ids、find_media_by_revision_ids）各自重复“空集合早退 + in_filter 批量查”两行模式。","file":"src/repository/catalog/sku.rs","id":"erp-catalog-005","lines":"148-186","proposal":"在 shared.rs 提供带空集合早退的通用 batch-by-ids helper，各仓储方法只声明字段名并委托。","severity":"中","status":"pending","title":"批量主键查询的空集合早退多处重复","updated_at":"2026-09-17"},{"category":"重复","current":"product.rs 的 select_current_product_revision/select_current_product_revisions 与 sku.rs 的 select_current_sku_revision/select_current_sku_revisions 逻辑完全同构（优先当前修订指针，缺失回退最大修订号；批量版按归属分组），仅实体类型与 id 字段不同。","file":"src/repository/catalog/sku.rs","id":"erp-catalog-006","lines":"930-973","proposal":"抽取以“取稳定 id、取当前修订指针、取修订号”三个访问器为参数的泛型 helper，两处各留一行特化。","severity":"中","status":"pending","title":"当前修订解析逻辑在商品与 SKU 两处镜像重复","updated_at":"2026-09-17"},{"category":"重复","current":"entity/catalog/sku.rs 的 legacy_listing_status 与 repository/catalog/sku.rs 的 legacy_sku_listing_status 是同一个“旧文档缺字段时兼容为已上架”的默认值，各自独立定义。","file":"src/entity/catalog/sku.rs","id":"erp-catalog-007","lines":"22-25","proposal":"只在实体层保留一个 pub(crate) legacy_listing_status_default，仓储投影的 serde default 引用它，兼容口径 single source。","severity":"中","status":"pending","title":"旧文档上架兼容默认值两处各自定义","updated_at":"2026-09-17"},{"category":"性能隐患","current":"latest_product_revision_no 与 latest_sku_revision_no 都是 find_by_product_ids/find_by_sku_ids 拉回该对象全部修订实体再在内存 max 修订号，修订数随时间线性增长。","file":"src/repository/catalog/product.rs","id":"erp-catalog-008","lines":"505-516","proposal":"改按 revision_no 降序 sort + limit 1 的投影查询只取最大号，内存占用与传输量恒定。","severity":"中","status":"pending","title":"最大修订号查询全量拉回再内存求 max","updated_at":"2026-09-17"},{"category":"性能隐患","current":"merged_product_sku_revisions 对该商品下每个 SKU 逐个调用 sku_revision_list（每次一次分页查询），SKU 多时查询数线性增长；且 total 累加全量而 items 截断 100，分页契约藏在 Service 循环里。","file":"src/service/catalog/product_detail.rs","id":"erp-catalog-009","lines":"126-148","proposal":"改一次 $in 批量拉回该商品全部 SKU 修订再内存排序截断，或在仓储层提供按 product 聚合的单次查询；total/items 截断契约抽为具名 helper 并注释。","severity":"中","status":"pending","title":"商品详情 SKU 修订按 SKU 逐个查询","updated_at":"2026-09-17"},{"category":"可读性","current":"service/catalog/sellable.rs 自带一个私有 normalized_text（trim 后空串转 None），与 DTO 层已复用的 application_core::normalized_text 语义完全一致。","file":"src/service/catalog/sellable.rs","id":"erp-catalog-010","lines":"137-150","proposal":"删除 sellable.rs 私有版本，直接复用 application_core::normalized_text。","severity":"低","status":"pending","title":"文本规范化 helper 与公共版本重复","updated_at":"2026-09-17"},{"category":"重复","current":"ProductFilter、SkuFilter、SkuRevisionFilter、ProductBrandFilter 的 Default 实现都是“page=1、page_size=20、其余空、降序”，字面量四处复制。","file":"src/repository/catalog/sku.rs","id":"erp-catalog-011","lines":"80-107","proposal":"在 persistence-core Pagination 侧或 catalog shared.rs 提供统一的缺省分页构造，各 Filter 默认复用。","severity":"低","status":"pending","title":"筛选条件缺省分页字面量多处复制","updated_at":"2026-09-17"},{"category":"重复","current":"sku_edit.rs 的 new_sku_edit_identity 与 existing_sku_edit_identity 构造同一个 SkuEditIdentity，仅 change_reason 取值不同（None vs 请求级原因），调用方需记住用哪个。","file":"src/service/catalog/sku_edit.rs","id":"erp-catalog-012","lines":"180-224","proposal":"合并为单个 from_product_sku_input(input, change_reason) 构造，Create 路径传 None，编辑路径传请求原因。","severity":"中","status":"pending","title":"SKU 编辑身份两种构造仅差一个参数","updated_at":"2026-09-17"},{"category":"错误处理","current":"duplicate_index_conflict_message 忽略索引名，对 product_no、(product_id, specification_signature)、sku_no 等所有唯一冲突返回同一句“数据已存在，请勿重复提交”，调用方无法区分是编号重复还是规格重复。","file":"src/error.rs","id":"erp-catalog-013","lines":"95-108","proposal":"在不改对外错误类（仍为 Conflict）的前提下，按唯一索引名映射到字段级提示文案；需先与接口文档对齐后再做。","severity":"低","status":"pending","title":"唯一冲突提示忽略索引名","updated_at":"2026-09-17"},{"category":"重复","current":"“!product.has_responsibility() → BusinessLogicError（商品缺少维护人或主属组织，请先交接）”同一守卫出现在 product_workflow.rs、listing.rs 两处、product_disable.rs，文案与判定复制。","file":"src/service/catalog/listing.rs","id":"erp-catalog-014","lines":"97-115","proposal":"给 Product 加 ensure_has_responsibility 方法（或 support.rs 的同名 helper），各命令入口统一调用。","severity":"中","status":"pending","title":"维护人缺失守卫与文案多处复制","updated_at":"2026-09-17"},{"category":"可读性","current":"排序白名单定义了两套：dto 侧 PRODUCT_SORT_FIELDS 等常量（给 normalize_sort 用）与仓储侧 *sort_doc 里的 match 白名单（给 Mongo 排序用），新增排序字段需同步两处且无编译期关联。","file":"src/dto/catalog/product.rs","id":"erp-catalog-015","lines":"17-24","proposal":"以一处白名单表（字段名常量）为源，dto 校验与仓储 sort_doc 都引用它；未知字段回退默认 created_at 的行为保持不变。","severity":"低","status":"pending","title":"排序字段白名单在 DTO 与仓储各存一份","updated_at":"2026-09-17"}],"source":"backend/crates/erp-catalog 只读分析（未改行为，未跑 cargo）","stats":{"approx_loc":22916,"file_count":89,"largest_files":["src/repository/catalog/sku.rs (1206)","src/repository/catalog/product.rs (802)","src/service/catalog/product_workflow.rs (769)","src/dto/catalog/product.rs (693)","src/service/catalog/voucher.rs (640)"]},"top3":["erp-catalog-001","erp-catalog-002","erp-catalog-003"]}